{
  "assessment_id": "asm_fixture_001",
  "diagnostic_id": "evercompass",
  "diagnostic_version": "1.0.0",
  "engine_version": "0.0.0-fixture",
  "criterion_results": [
    {
      "criterion_id": "attract.marketing_strategy.audience",
      "journey_stage": "attract",
      "dimension": "marketing_strategy",
      "score": 2,
      "classification": "needs_attention",
      "finding_id": "F-001"
    },
    {
      "criterion_id": "attract.ux_design.landing_pages",
      "journey_stage": "attract",
      "dimension": "ux_design",
      "score": 4,
      "classification": "strong",
      "finding_id": null
    }
  ],
  "findings": [
    {
      "finding_id": "F-001",
      "criterion_id": "attract.marketing_strategy.audience",
      "journey_stage": "attract",
      "dimension": "marketing_strategy",
      "type": "issue",
      "severity": "high"
    }
  ],
  "dimensions": {
    "marketing_strategy": {
      "criteria": ["attract.marketing_strategy.audience"],
      "findings": ["F-001"],
      "summary": { "classification_distribution": { "needs_attention": 1 } }
    },
    "ux_design": {
      "criteria": ["attract.ux_design.landing_pages"],
      "findings": [],
      "summary": { "classification_distribution": { "strong": 1 } }
    },
    "brand_identity": {
      "criteria": [],
      "findings": [],
      "summary": { "classification_distribution": {} }
    },
    "systems_integration": {
      "criteria": [],
      "findings": [],
      "summary": { "classification_distribution": {} }
    }
  },
  "journey_stages": {
    "attract": {
      "criteria": ["attract.marketing_strategy.audience", "attract.ux_design.landing_pages"],
      "findings": ["F-001"],
      "summary": { "classification_distribution": { "needs_attention": 1, "strong": 1 } }
    },
    "engage": {
      "criteria": [],
      "findings": [],
      "summary": { "classification_distribution": {} }
    },
    "convert": {
      "criteria": [],
      "findings": [],
      "summary": { "classification_distribution": {} }
    },
    "retain": {
      "criteria": [],
      "findings": [],
      "summary": { "classification_distribution": {} }
    }
  },
  "priorities": [
    {
      "priority_id": "P-001",
      "title": "Illustrative fixture priority -- not real business logic",
      "supporting_findings": ["F-001"],
      "journey_stages": ["attract"],
      "dimensions": ["marketing_strategy"]
    }
  ],
  "system_summary": {
    "criteria_total": 2,
    "criteria_applicable": 2,
    "criteria_not_applicable": 0,
    "findings_total": 1,
    "severity": { "critical": 0, "high": 1, "moderate": 0, "low": 0 },
    "priority_count": 1,
    "journeys_requiring_attention": ["attract"],
    "dimensions_requiring_attention": ["marketing_strategy"]
  }
}
